{
  "$schema": "https://json-schema.org/draft/2020-12/schema",
  "$id": "https://schemas.localwaves.dev/agency-os-bridge/v1/health.response.json",
  "title": "health response",
  "description": "",
  "type": "object",
  "properties": {
    "ok": {
      "const": true
    },
    "idempotentReplay": {
      "type": "boolean",
      "description": "v1.0.1: true on a response replayed from the idempotency store (EmDash strips the X-AOS-Idempotent-Replay header)"
    },
    "paired": {
      "type": "boolean"
    },
    "previewConfigured": {
      "type": "boolean",
      "description": "v1.0.4: see siteInfo.previewConfigured"
    },
    "contract": {
      "type": "integer",
      "minimum": 1
    },
    "siteId": {
      "$ref": "common.json#/$defs/siteId"
    },
    "keyId": {
      "type": "integer",
      "minimum": 1
    },
    "outbox": {
      "type": "object",
      "properties": {
        "pending": {
          "type": "integer",
          "minimum": 0
        },
        "failed": {
          "type": "integer",
          "minimum": 0
        },
        "paused": {
          "$ref": "common.json#/$defs/outboxPause"
        }
      },
      "required": [
        "pending",
        "failed"
      ]
    },
    "schedulerLastRunAgoMin": {
      "anyOf": [
        {
          "type": "integer",
          "minimum": 0
        },
        {
          "type": "null"
        }
      ]
    },
    "lastEventAt": {
      "anyOf": [
        {
          "$ref": "common.json#/$defs/dateTime"
        },
        {
          "type": "null"
        }
      ]
    },
    "lastCursor": {
      "type": "integer",
      "minimum": 0
    },
    "keys": {
      "$ref": "common.json#/$defs/keyState",
      "description": "v1.5.6 (§32.1): key generation and previous-key state; never a key"
    },
    "versions": {
      "type": "object",
      "properties": {
        "plugin": {
          "type": "string"
        },
        "emdash": {
          "type": "string"
        },
        "astro": {
          "anyOf": [
            {
              "type": "string"
            },
            {
              "type": "null"
            }
          ]
        },
        "framework": {
          "anyOf": [
            {
              "type": "string"
            },
            {
              "type": "null"
            }
          ]
        }
      },
      "required": [
        "plugin",
        "emdash"
      ]
    }
  },
  "required": [
    "ok",
    "paired",
    "contract",
    "outbox",
    "lastCursor",
    "versions"
  ]
}
